name,title,coding
t3_jxv3lj,Trump lawyers to avoid Michigan lawmaker meeting after COVID exposure,
t3_jyvp60,"What lies ahead: After the damage of the Trump era, can America avoid disaster?",
t3_jxwjjb,A memo to President-elect Biden: Don’t coddle white racial anxieties,
t3_jyz9gp,Chris Christie calls Trump’s legal team a ‘national embarrassment’,
t3_jy3im1,Joe Biden Should Reach Out to China for Help on North Korea,
t3_jyw4pb,"Trump’s legal team cried vote fraud, but courts found none",
t3_jy32gf,Trump Judges Strike Down Bans On LGBTQ ‘Conversion Therapy’,
t3_jxqsqt,Ivanka Trump called the New York investigations into the Trump Organization's finances 'harassment' and motivated by 'rage',
t3_jxzn79,Donald Trump Jr. Infected by Coronavirus and in Isolation,
t3_jyd786,Trump supporters plan D.C. rally two days before electoral college votes are cast,
t3_jynt1e,Trump tells G20 leaders he wants to work with them ‘for a long time’,
t3_jy96f8,Shields and Brooks on the danger of Trump’s refusal to concede,
t3_jy853m,US Chamber of Commerce chief calls on Trump to stop delaying transition to Biden presidency,
t3_jxztlz,The Trump campaign allegedly mixed up Michigan and Minnesota in its election lawsuit,
t3_jyufz5,‘Something very historical’: Native Americans push for diverse Biden Cabinet,
t3_jyarxl,Neal Katyal: All of Trump’s criminal immunity expires in about 60 days,
t3_jyw7xm,Pompeo touts Iran policy in Gulf ahead of Biden presidency,
t3_jxqni3,"Trump, allies make frantic steps to overturn Biden’s victory",
t3_jyxqd1,Chris Christie: Trump's legal team 'a national embarrassment',
t3_jy5c91,Trump Got Tricked by a Twitter Troll Posing as His Sister,
t3_jyyti8,Biden's 1st Cabinet picks expected Tuesday amid road blocks,
t3_jxswcm,Trump supporter election lawsuit affidavit seems to mix up Michigan and Minnesota,
t3_jxt9aq,"Biden brushes aside Trump attempts to overturn the election, confident his victory will stand",
t3_jxtl1x,Maryland Gov. Hogan: Trump’s refusal help Biden transition team is ‘outrageous’,
t3_jxzg8v,Opinion | Supporting Trump's election fraud lies betrays both Georgia voters and GOP ideals,
t3_jxs2y8,"'A study in contrasts': Unlike Biden, Trump had a 'fast and furious' transition four years ago",
t3_jyny1g,A Judge Demolished The Trump Campaign’s Effort To Undo Biden’s Win In Pennsylvania And Push Fraud Conspiracies,
t3_jxrtap,Trump’s Indifference Amounts to Negligent Homicide,
t3_jxxiya,Trump refuses to take questions after falsely claiming he won election in first media appearance in weeks. No sitting US president has falsely claimed an election victory from the Brady Briefing Room. Until Friday,
t3_jyy5hi,"Trump, the Saboteur. First a Tantrum, Then Taking Every Opportunity to Trash Our Government",
t3_jywqno,"Twitter, Facebook to hand over @POTUS account to Biden on January 20",
t3_jyk4r9,Liz Cheney: Trump should respect ‘the sanctity of our electoral process’,
t3_jxq0iy,Romney says he can't imagine 'a more undemocratic action' than what Trump's done,
t3_jxpjet,Trump to meet Michigan lawmakers in bid to overturn electoral defeat,
t3_jy8elg,Most Republicans greet Trump’s push to overturn the election with a customary response: Silence,
t3_jy4hqf,"Facing an Election Loss, President Donald Trump Turns to Raw Political Power to Try to Bend the Outcome",
t3_jy1jnw,Michigan election officials promise to ‘follow the law’ after controversial meeting with Trump,
t3_jy06fc,Could limiting corporate candidates complicate Biden’s diversity push?,
t3_jyqqwc,FDA authorizes emergency use of the antibody cocktail given to Trump to treat Covid-19,
t3_jyq2xw,Georgia will conduct recount after Trump campaign request,
t3_jycumy,How Members of Anti-Immigrant Extremist Groups Have Worked Closely with — and Joined — the Trump Administration,
t3_jyqnjd,"In pushing his claims to the limit, Trump has revealed the fragility of the voting system - and shaken it",
t3_jy3mi8,"Team Trump Leaders, Including Campaign Manager Bill Stepien, Have No Faith in Rudy",
t3_jyyzt4,Netanyahu says Biden must not go back to Iran deal,
t3_jxuz76,Why Joe Biden’s low-key approach may pay off,
t3_jy46k6,Letters to the Editor: Stop Donald Trump's coup. Impeach him again,
t3_jy5na8,Michigan Legislators Spurn Trump’s Bid to Overturn Election Results,
t3_jymtbq,Megathread: Judge Dismisses Trump Lawsuit Seeking to Delay Certification in Pennsylvania,
t3_jyktn9,Trump playing Golf instead of cooperating to fight the Coronavirus Pandemic,
t3_jyy70d,Putin Says He’s Not Ready to Recognize Biden as U.S. President,
t3_jyym78,"Biden will announce first Cabinet picks on Tuesday, chief of staff Klain says",
t3_jya174,Judge slaps down Trump appointee who has sought to reshape Voice of America and related agencies,
t3_jyxu4b,Biden advisor: 'He does not have any concern' about Trump lawsuits,
t3_jxxrc7,Georgia secretary of state certifies election results that show state’s voters chose Joe Biden for president,
t3_jy104z,Biden’s Electoral College victory projected to be same as Trump’s in 2016,
t3_jycmh4,A destructive legacy: Trump bids for final hack at environmental protections,
t3_jybgkx,Op-Ed: How Biden can restore U.S. global leadership after Trump's retreat from international institutions,
t3_jxz18x,"OMB Documents Obtained by Chairs Yarmuth, Lowey, Maloney Show Trump Admin Withheld WHO Funds to Combat the Coronavirus Pandemic with Same Tactic Used in Illegal Ukraine Impoundment",
t3_jyxajt,"After Pennsylvania legal defeat, Trump digs in despite new pressure to concede election",
t3_jxyyrs,Can Trump overturn the election result?,
t3_jy18x9,'We Will Follow The Law': Michigan Lawmakers Defend Election After Trump Meeting,
t3_jynjyq,Wisconsin officials: Trump observers obstructing recount,
t3_jyamtf,Barack Obama: ‘Donald Trump and I tell very different stories about America’,
t3_jxrr8b,Sen. Lamar Alexander says no evidence of voter fraud: Biden should receive briefings,
t3_jxq3rg,Trump and Rudy Giuliani’s lawsuits challenging the election are a clown show,
t3_jxz1e4,Bizarre false Facebook video claiming Biden paid a mob boss for 300k votes goes viral,
t3_jyagwt,Opinion: About that page of pro-Trump letters...,
t3_jyvt2z,Wisconsin officials: Trump observers obstructing recount | Election officials overseeing the recount of presidential votes in Wisconsin’s largest county are accusing observers for President Donald Trump of unduly slowing the process,
t3_jyuup3,Trump Wonders Why Joe Biden Is Forming A Cabinet In Latest Tweet Screed,
t3_jyxjcj,Can America Restore the Rule of Law Without Prosecuting Trump?,
t3_jyl6g3,Let Trump Off the Hook in the Name of Elusive Unity? Some Critics Say That Could Be a Big Mistake,
t3_jxujgk,Georgia certifies Biden’s victory,
t3_jxyyrs,Can Trump overturn the election result?,
t3_jyx75d,House Democratic Caucus chairman: Trump's presidency was a 'scam',
t3_jy2x8h,Michigan election staff recommend certification of Biden win,
t3_jxpwwp,Making the Most of the Coming Biden Boom,
t3_jy08r4,Michigan leaders summoned to White House as Trump attempts to subvert election,
t3_jyv7ng,Spy Jonathan Pollard expected to fly to Israel after US lifts parole. Release marks latest gesture by departing Trump administration towards the Israeli government,
t3_jy0s0y,DeSantis and Bondi disappear as Trump’s election challenges grow desperate and chaotic,
t3_jy6uie,A destructive legacy: Trump bids for final hack at environmental protections,
t3_jxz8g9,Georgia governor certifies presidential electors for Biden,
t3_jxpf25,Trump Fires US Cybersecurity Director Chris Krebs After Krebs Debunks Trump's Claims Of Election Systems Fraud,
t3_jxqttp,"Trump's top aides are 'avoiding' his legal team to distance themselves from his attempt to subvert the election results, report says",
t3_jyvrie,"Trump's embarrassing, incompetent, humiliating, very sad coup",
t3_jxxwei,Biden’s frontrunners to replace Kayleigh McEnany as press secretary are both black women,
t3_jxsoge,Biden campaign: Trump efforts to derail Michigan election results an 'abuse of office',
t3_jywxtu,Michigan GOP Congressman Tells Trump 'It's Over': 'The Voters Spoke',
t3_jxvr8r,"Biden is considering making Merrick Garland, denied Supreme Court seat, the attorney general",
t3_jxtupb,'Call His Bluff': Edward Norton's Viral Message On Trump,
t3_jxz1e4,Bizarre false Facebook video claiming Biden paid a mob boss for 300k votes goes viral,
t3_jyl6wx,"""Pathetic"": Geraldo Rivera mocked by TV anchors for suggesting ""The Trump"" as name for COVID vaccine",
t3_jy5qo8,Biden's margin of victory widens as Trump's subversion efforts grow more frantic,
t3_jyyy5l,"Biden inauguration will be scaled down amid COVID, aide says",
t3_jxss00,Bob Corker: Republicans ‘have an obligation’ to challenge Trump’s voter fraud allegations,
t3_jxtzmv,Michigan GOP lawmakers heckled on arrival for White House meeting | The meeting comes as Trump's lawyers call for state legislatures to name electors for Trump in states Biden won.,
t3_jxz5ec,How the GOP Is Helping Trump’s War on Democracy. They are giving the president “space” to poison the national debate and to try to overturn an election.,
t3_jxxo0f,"Trump’s efforts to flip Michigan election results raise significant legal, ethical questions: Experts",
t3_jy2xm1,See what Michigan lawmakers said after Trump meeting,
t3_jyxpbd,Trump Campaign Lawyers Step Up but Are Swiftly Knocked Down,
t3_jxs7jx,Shirkey and Chatfield: Your meeting with Trump is dangerous,
t3_jy8qby,"Joe Biden: Why Are Reporters Asking Me Questions? On Friday, Biden appeared dumbfounded as to why a reporter was asking the projected Democratic presidential-elect a question as the press pool was being scurried away by staff.",
t3_jy2icm,Donald Trump Jr. tests positive for COVID-19,
t3_jy17l6,"Kayleigh McEnany Obliterates Both Dems, Media for Hypocrisy Over Election Results, Completely Levels CNN Reporter: ""Where were the calls for unity and a peaceful transition when President Trump was elected in 2016?""",
t3_jxxwkh,“Trump Makes Late-Term Bid to Lower Prescription Drug Costs”,
t3_jysprc,FDA Grants Emergency Use Authorization To Antibody Cocktail Used By Trump,
t3_jy0ud9,‘Enormously insulting’: Sanders warns Biden not to shut out progressives,
t3_jypb2u,Philly Bans All Indoor Gatherings Unless You're Still Counting Biden Votes,
t3_jytan4,Detroit voters sue President Trump over his attempt to block certification of election results,
t3_jyz99e,Trump Lawyer Sidney Powell Promises 'Biblical' Lawsuit in Coming Days,
t3_jy248u,Anti-Trump Legal Team Withdraws In Pennsylvania,
t3_jxdwum,"Sidney Powell: Absent software fraud, Trump 'had at least 80 million votes'",
t3_jy0f6f,Donald Trump Jr tests positive for coronavirus,
t3_jxkgxv,Report: Biden’s proposed gun control plan could hit gun owners with $34 billion in taxes,
t3_jy6h4r,"Romney on Trump election tactics: 'Difficult to imagine a worse, more undemocratic action' by president",
t3_jycf2v,"Biden Emerges from the Basement for a Few Words, but Trips Over His Own Incoherence Again",
t3_jxqrev,Giuliani: ‘Massive Fraud’: Trump lawyers present chapter and verse in presser,
t3_jxorjf,"Biden’s COVID Plan: Close The Economy, Open The Border",
t3_jyv0um,FDA Grants Emergency Use Authorization To Antibody Cocktail Used By Trump,
t3_jydj00,"LIVE: March for Trump in Atlanta, Georgia",
t3_jxvx68,"Biden stuggles with words at press conference -- 'I'm going to ... employ the defense, reconstruct the act'",
t3_jxnh2b,Lawyer working on Trump Pennsylvania effort placed under official protection due to threats,
t3_jxby2q,Biden vows there will be no national shutdown,
t3_jxx90k,Lara Trump Eyes 2022 NC Senate Bid [VIDEO],
t3_jxy7sk,Biden is now asking for donations in case there is no peaceful transition of power,
t3_jxz230,"In Court, Trump's Lawyers Aren't Claiming 'Massive' Fraud",
t3_jxgcqs,"Georgia recount results: Biden still ahead by 12,000 — but Trump has one last roll of the dice",
t3_jxuonz,Elected DNC Member Floats Re-Education Camps for Trump Supporters,
t3_jy8qby,"Joe Biden: Why Are Reporters Asking Me Questions? On Friday, Biden appeared dumbfounded as to why a reporter was asking the projected Democratic presidential-elect a question as the press pool was being scurried away by staff.",
t3_jxpzsx,Georgia Secretary of State to certify election for Biden,
t3_jxhdtu,"Lin Wood Savagely Schools Fox News' Dana Perino, Who Suggested Dominion Should Sue Trump's Legal Team",
t3_jyc5wq,Bo Erickson of CBS asks Biden about his son. He says it's just a smear campaign.,
t3_jy0vje,Trump's daughter-in-law Lara reported to be considering 2022 Senate run,
t3_jynp3x,"Trump Orders Hasty Afghanistan, Iraq Drawdowns to Beat Biden Inauguration",
t3_jxuny2,An Embarrassing Error by Trump's Legal Team,
t3_jxqize,"‘Code Monkey’ and ‘Inventor of Email’, Are Said to Be Assisting Trump in Exposing Dominion Voting Systems",
t3_jxuoli,Biden certified Georgia winner after hand recount,
t3_jy9cvg,U.S. Corporations with 'Made in China' Goods 'Optimistic' About Joe Biden,
t3_jxc440,"Trump Campaign Withdrawing Lawsuit in Michigan After Wayne County ‘Relief,’ Says Giuliani",
t3_jxtyny,Insider Tells What It’s Really Like In The Trump White House: Cordial And Efficient,
t3_jy0z01,House Budget Committee Investigation Exposes Trump Administration’s Systemic Abuse of Executive Spending Authority,
t3_jybaky,"AOC, Other Far-Left Radicals Turn Up the Heat on Biden to Accept Their Socialist Demands",
t3_jxd71m,Butterball Releases Turkey With Biden-Harris Logo So You Can Just Say Your Thanksgiving Gathering Is A Political Rally,
t3_jyunuj,"Trump campaign adviser Steve Cortes: Sudden Stop In Mail-In Vote Count 'Suspicious' -- Particularly since it was followed by a ""deluge"" of votes for Joe Biden in key battleground states.",
t3_jyqipn,Time is just not on Trump’s side to overturn 2020 election results,
t3_jyaufj,Berkeley professor sparks outrage by claiming Trump supporters who have an 'indifference' to COVID are like Germans who 'ignored and profited from the Holocaust',
t3_jxp6c1,Top Border Officials Warn About Disastrous Effects of Biden's Promise to Stop Building the Border Wall,
t3_jyvpw5,BREAKING: FDA Grants Emergency Use Authorization To Antibody Cocktail Used By Trump,
t3_jy8kt6,"Obama to produce Netflix series about Trump transition, unclear whether it will include abusing intel agencies to spy on successor",
t3_jxe10r,The Hill’s Joe Concha Takes Blowtorch to Pro-Biden ‘Marshmallow Media’,
t3_jxvx68,"Biden stuggles with words at press conference -- 'I'm going to ... employ the defense, reconstruct the act'",
t3_jxuny2,An Embarrassing Error by Trump's Legal Team,
t3_jxo83f,Hunter Biden had deep business ties with communist party-linked Chinese tycoon: new Senate report,
t3_jxj0e4,"Major LGBT Group Urges Biden to Strip Accreditation of Christian Schools, Colleges",
t3_jxs0up,Biden Deputy Chief of Staff Pushed 'Mandatory' Firearm Buybacks,
t3_jycf2v,"Biden Emerges from the Basement for a Few Words, but Trips Over His Own Incoherence Again",
t3_jy47z9,Biden Mocks a Reporter for Asking a Question as Biden's Staff Tries to Get the Press Out of There,
t3_jykt0d,Michigan AG Suggests Criminally Charging Republican Legislators for Meeting With Trump,
t3_jyoy6m,Biden to ‘Racist’ Trump Voters: ‘Let’s Heal.’ That’s Easy for Him to Say.,
t3_jxrtzo,Top Border Officials Warn About Disastrous Effects of Biden's Promise to Stop Building the Border Wall,
t3_jxz4ek,Biden to Impose $200 Gun Tax | Americans for Tax Reform,
t3_jxzw8k,Donald Trump: ‘Big Pharma’ Purposely Delayed Coronavirus Vaccine Until After Election,
t3_jxnvxb,"After UN ‘Database’ Targets Israeli Settlements, Trump Administration to Blacklist BDS Supporters",
t3_jxfvtx,Obamas Producing Netflix Government Comedy Series Inspired by Anti-Trump Book 'The Fifth Risk',
t3_jy0aqe,"BLM Co-founder: Biden's election was 'won by Black people', 'We want something for our vote.'",
t3_jxxtr7,Trump lawyers cited Minnesota counties in affidavit about Michigan: report,
t3_jybfam,"BLM, Squad members pushing Dems, Biden to abolish prison",
t3_jxf7g0,The Human Rights Campaign's 'Sinister' Demand of Biden,
t3_jxsxuq,National Democratic Party official suggests re-education for Trump supporters: 'How do you deprogram 75 million people?',
t3_jxmbiw,Joe Biden Keeps Lead in Georgia After Recount; Giuliani Says Recount ‘Means Nothing’,
t3_jxochk,"New Senate report purportedly 'confirms' Biden family's business ties to Chinese, Russian governments",
t3_jxoj2j,"Biden turns 78, will be oldest US president",
t3_jxzjwc,"Ga. Gov Will Certify Election for Biden, but Demands Answers on Discrepancies",
t3_jyp7pw,"Judge Dismisses Trump Campaign’s Pennsylvania Lawsuit, Slams ‘Strained’ Reasoning; This only helps these cases reach higher levels of court because signed affidavits are admissible in court",
t3_jylfat,Hispanic Voters In Florida Who Fled Dictatorships Think The Election Was Stolen From Trump,
t3_jxpgk3,"Birthday Time: Biden Turns 78, If Confirmed Will Be Oldest US President",
t3_jyobi4,Michigan Legislators Face Calls For Possible Criminal Charges After Meeting With President Trump On Certification,
t3_jxfwdu,Trump Summons Michigan GOP Leaders for Extraordinary Meeting,
t3_jxeeir,Tevi Troy: When Senator Biden lectured Israeli Prime Minister Begin over settlements,
t3_jywt9q,Joe Biden Witnesses A Crime.,
t3_jyby0o,Trump Announces Groundbreaking Rules to Lower Prescription Drug Prices,
t3_jysdc9,Body Language - Obama Advice To President Trump,
t3_jxg84e,NRA Presents Biden With Prestigious 'Gun Salesman Of The Month' Award,
t3_jxvhyz,Lin Wood: President Trump won 400 electoral votes | One America News Network,
t3_jxraf0,"While You Were Focused on The Kraken, the Senate Continued Confirming Trump Federal Judges",
t3_jxr35h,Biden marks Transgender Day of Remembrance,
t3_jy56dt,Trump Announces New Regulations Lowering Prescription Drug Costs,
t3_jxnwph,Catholic Bishop: 'I Beg Mr. Biden to Repent of His Dissent From Catholic Teaching on Abortion &amp; Marriage',
t3_jyp309,"Lockdown Addicts -- New data from Sweden show it’s safe to keep schools open, but Joe Biden’s Covid-19 advisors seem more interested in shutting down.",
t3_jyp5q9,Actor Scott Baio threatens to move to Utah to unseat Sen. Mitt Romney after his anti-Trump tweet,
t3_jycog9,‘Beltway Biden’ Moves the Skeletons in His Closet to the White House.,
t3_jy16dv,"New Senate Report Confirms Hunter Biden's Biz ties to CCP, Raises Troubling Ties to Kremlin",
t3_jxhao0,"Trump Campaign: Thousands of mail-in ballots invalid, should be tossed | One America News Network",
t3_jxp64e,"Ossoff Dodges on Warnock's Praise for Anti-Semitic Pastor - Washington Free Beacon “Them Jews...” this guy is who the Dems are running in Georgia?? (I wonder how many comments will be made in this post akin to “but, meh tRuMp”)",
t3_jyqh97,"Chinese Warn Against Communism at Trump Rally, Tell Americans to Speak Out",
t3_jxd9d2,Biden declares there will be 'no national shutdown',
t3_jxh1k3,Satire: NRA Presents Biden With Prestigious 'Gun Salesman Of The Month' Award,
t3_jxyuk9,Trump Makes Late-Term Bid to Lower Prescription Drug Costs,
t3_jxuoli,Biden certified Georgia winner after hand recount,
t3_jybaah,"Rudy and Sidney’s Krakentastic Spectacle, and What It Could Mean -- A dismissive legacy media might have panned Team Trump’s press conference Thursday, but it was a significant moment with significant portents.",
t3_jyuhux,Trump campaign attorney responds to Pennsylvania ruling &amp; they’re grateful,
